{
  "schema": "project-cognition/state/v1",
  "revision": 39,
  "mission": {
    "purpose": "Preserve evidence-backed project intent and give AI-assisted software work an auditable definition of done, so locally reasonable edits do not accumulate into architecture or goal drift.",
    "intended_users": [
      "maintainers using AI coding agents for multi-step software work",
      "teams that need project-level memory, explicit invariants, and bounded completion"
    ],
    "use_cases": [
      "read-only project research before deciding what to build",
      "cross-session carriage of project purpose, architecture, evidence, decisions, and unknowns",
      "evidence-bound Simple or Governed coding loops with explicit stopping conditions"
    ],
    "environment": [
      "Node.js 22.12 or newer",
      "DeepSeek Harness 0.1.1-rc.2 is the pinned first client runtime; protocols v1.4-v1.11 produced preserved partial, negative, or invalid official Flash evidence, and protocol v1.12 is an offline-only scorer correction with the E1 live round stopped",
      "portable JSON/core modules and HostEvent v1 are client-independent; non-DSH adapters are not implemented, while version-locked Claude Code Agent SDK 0.3.251 and Codex App Server stdio 0.150.0-alpha.12.2 discovery records are both HOLD"
    ]
  },
  "architecture": {
    "components": [
      "Researcher Application: certified read-only project cognition producer",
      "Cognition Core: canonical project state, authority/proof status, freshness, Markdown projection",
      "Goal Core: approved contract revisions, attempt/event fold, completion decision state machine",
      "Verifier Core: frozen invocation hashes and trusted session evidence evaluation",
      "DSH Adapter: /researcher entryways, session-log replay, human gates, hard stop/pause/complete authority",
      "Adapter Core: portable HostEvent v1 plus one-shot researcher.ask and persistent researcher.mode control semantics",
      "Evaluation Governance: blind snapshots, locks, validity gates, feedback telemetry",
      "Evidence Bundle Integrity: deterministic raw-byte commitment, external Ed25519 signature verification, and verdict-aware offline scoring",
      "Model Cost Admission: frozen provider/model/resolved DeepSeek base URL, Beijing-time blackout windows, immutable settings, absolute deadlines, and independently recomputed host receipts"
    ],
    "boundaries": [
      "JSON state is normative; PROJECT_COGNITION.md is generated and must not be edited as a second truth",
      "The Research Session Ledger is provisional session evidence, not canonical project truth; it cannot directly change Project Cognition or authorize execution",
      "Promoting a research finding requires an explicit draft cognition revision, owner review, sealing, and deterministic projection regeneration",
      "Research produces evidence and draft handoff but never execution authority",
      "Models may execute and report observations but only the host governor may choose a terminal state",
      "Client adapters must not weaken portable contract, verifier, project-root, or human-approval semantics",
      "Recorded goal terminal events must equal the decision independently derived from their preceding evidence; labels and signatures cannot replace host or worktree evidence",
      "Goal Contract v1 scope fields are semantic constraints, not a generic filesystem allowlist; only E1 allowed_changes currently has hard path enforcement",
      "Model cost admission constrains only the official E1 runner; it does not prove OS-wide egress isolation, provider billing identity, or the absence of out-of-band calls"
    ]
  },
  "value_claims": [
    {
      "id": "V1",
      "statement": "The repository implements distinct draft/canonical schemas, deterministic canonical state hashing, sealed-only exact-next promotion, strict validation, complete revision lineage, prefix-derived terminal decisions, event replay, and generated Markdown projection.",
      "authority": "repository_observed",
      "proof_status": "proven_within_scope",
      "scope": "current repository unit and CLI behavior",
      "confidence": 0.99,
      "evidence_refs": [
        "E1",
        "E2",
        "E7"
      ],
      "invalidation_conditions": [
        "tests fail",
        "a hash-bound object accepts undetected mutation",
        "projection differs across identical state"
      ],
      "freshness": {
        "status": "unknown",
        "checked_at": "2026-08-24"
      }
    },
    {
      "id": "V2",
      "statement": "The DSH adapter can mechanically reject in-session fabricated or verifier-drifted evidence and reserves goal terminal authority for the host plugin.",
      "authority": "repository_observed",
      "proof_status": "supported",
      "scope": "pure replay tests plus protocol v1.4-v1.11 official Flash evidence under a trusted host operator and model-inaccessible evidence root: forged evidence was refused, invalid duplicate attempts were rejected, v1.8 refused derived DONE without the formal decision tool, v1.10 produced four PASS tracks without a false terminal, and v1.11 resumed the same session to a host-owned DONE before its frozen scorer rejected a mismatched replay domain. A later offline diagnostic supports only the narrow scope correction and cannot upgrade the original INVALID result. These incomplete/invalid bundles support only rejection, replay, and host-authority mechanisms, not complete conformance, provider identity, or outcome value",
      "confidence": 0.88,
      "evidence_refs": [
        "E1",
        "E2",
        "E3",
        "E7",
        "E9",
        "E11",
        "E12",
        "E13",
        "E14",
        "E15",
        "E16",
        "E17",
        "E18",
        "E19"
      ],
      "invalidation_conditions": [
        "a live DSH model can complete through an ungoverned tool",
        "replay differs from live execution",
        "a forged call id yields pass"
      ],
      "freshness": {
        "status": "unknown",
        "checked_at": "2026-08-29"
      }
    },
    {
      "id": "V3A",
      "statement": "Persisted Project Cognition improves longitudinal maintenance outcomes compared with reconstructing project intent in each session.",
      "authority": "model_inferred",
      "proof_status": "hypothesis",
      "scope": "future multi-stage cognition-value experiments; not the Goal Governor E2 contrast",
      "confidence": 0.35,
      "evidence_refs": [
        "E1",
        "E2"
      ],
      "invalidation_conditions": [
        "pre-registered longitudinal trials show no material reduction in reconstruction cost, stale assumptions, or architecture drift"
      ],
      "freshness": {
        "status": "unknown",
        "checked_at": "2026-08-24"
      }
    },
    {
      "id": "V3B",
      "statement": "Goal Governor reduces false completion, scope drift, and human correction cost compared with Research-only sessions using equal handoff content.",
      "authority": "model_inferred",
      "proof_status": "hypothesis",
      "scope": "future pre-registered E2 Condition B versus Condition C comparison",
      "confidence": 0.35,
      "evidence_refs": [
        "E1",
        "E2"
      ],
      "invalidation_conditions": [
        "a valid pre-registered E2 comparison fails its material-effect and cost thresholds"
      ],
      "freshness": {
        "status": "unknown",
        "checked_at": "2026-08-24"
      }
    },
    {
      "id": "V4",
      "statement": "The same portable contracts and reducers can support Codex, Claude Code, Zed/Zcode, OpenClaw, or similar clients when an adapter proves all five governed capabilities.",
      "authority": "model_inferred",
      "proof_status": "hypothesis",
      "scope": "architecture portability; only the DSH adapter exists. Version-locked Claude Code Agent SDK 0.3.251 and Codex App Server stdio 0.150.0-alpha.12.2 discovery records map candidate interfaces but are both HOLD. Claude's real SDK session-read functions returned expected empty results under an isolated config, then parsed one non-empty host-authored JSONL fixture without model use or byte mutation. This proves only local parser behavior, not an authentic session, resume, replay, tool, approval, compatibility, or conformance capability. Two Codex turn attempts may have reached a billable completion path, but cleanup failure discarded their trace, so they are INVALID discovery incidents. Neither client establishes an observed governed capability, compatibility, or conformance",
      "confidence": 0.55,
      "evidence_refs": [
        "E1",
        "E20"
      ],
      "invalidation_conditions": [
        "a target client cannot provide durable ordered events, trusted verifier evidence, project-root confinement, a host-owned approval channel with an explicit identity-assurance level, or hard stop"
      ],
      "freshness": {
        "status": "unknown",
        "checked_at": "2026-08-24"
      }
    },
    {
      "id": "V5",
      "statement": "Experiment C+ proves Researcher is superior to an ordinary agent.",
      "authority": "repository_observed",
      "proof_status": "refuted",
      "scope": "the historical Experiment C+ causal claim",
      "confidence": 0.99,
      "evidence_refs": [
        "E4"
      ],
      "invalidation_conditions": [
        "None for this historical record: a new valid experiment may establish a separately identified claim but cannot rehabilitate Experiment C+"
      ],
      "freshness": {
        "status": "unknown",
        "checked_at": "2026-08-24"
      }
    }
  ],
  "invariants": [
    {
      "id": "I1",
      "statement": "The certified Researcher remains read-only and cannot implement or approve its own handoff.",
      "lifecycle": "ratified",
      "strength": "hard",
      "authority": "owner_ratified",
      "evidence_refs": [
        "E1",
        "E5"
      ],